{"artifact_manifest":{"envelope_log_uri":"none","event_loop_states_uri":"none","report_artifact_uri":"D:\\Dev\\Workspaces\\Repos\\Claire_de_Binare\\artifacts\\replay_reports\\mexc_multi_window_3032\\window_014\\replay-db2a6fde2f0c-0002\\report.json","supplementary_artifacts":{"config_resolved_uri":"D:\\Dev\\Workspaces\\Repos\\Claire_de_Binare\\artifacts\\replay_reports\\mexc_multi_window_3032\\window_014\\replay-db2a6fde2f0c-0002\\config.resolved.json","env_redacted_uri":"D:\\Dev\\Workspaces\\Repos\\Claire_de_Binare\\artifacts\\replay_reports\\mexc_multi_window_3032\\window_014\\replay-db2a6fde2f0c-0002\\env_redacted.txt","operator_summary_uri":"D:\\Dev\\Workspaces\\Repos\\Claire_de_Binare\\artifacts\\replay_reports\\mexc_multi_window_3032\\window_014\\replay-db2a6fde2f0c-0002\\operator_summary.json"}},"config_snapshot":{"breakout_buffer":0.0005,"entry_lookback_minutes":240,"exit_lookback_minutes":120,"min_minutes_between_entries":60,"trade_side_mode":"long_only"},"dataset_summary":{"candles_total":2726,"dataset_fingerprint":"1ae0166f9c096b2546561ec84c852c314dd537ccfc82858baaad5691722706e8","period_end_ts_ms":1778505780000,"period_start_ts_ms":1778356680000,"requested_period_end_ts_ms":1778505780000,"requested_period_start_ts_ms":1778342280000,"scheduler":{"event_time_span_ms":149100000,"live_candle_count":2486,"profile":"instant","warmup_count":240},"symbol":"BTCUSDT","timeframe":"1m"},"envelope_summary":{"decision_envelopes_total":0,"fill_envelopes_total":0,"order_envelopes_total":0},"execution_result":{"decisions_made":0,"envelope_hashes":[],"events_processed":2726,"fills_recorded":0,"orders_placed":0,"run_id":"replay-db2a6fde2f0c-0002"},"gate_result":{"failed_criteria":["min_closed_trades_total","min_profit_factor"],"notes":"failed criteria","review_flags":[],"status":"FAIL"},"metrics":{"buy_signals_total":0,"closed_trades_total":0,"data_integrity_diagnostics":{"data_integrity_reason":"clean","pending_signals_at_end":[]},"data_integrity_ok":true,"deterministic_replay_ok":true,"expectancy_r":0.0,"fees_total_quote":0,"gross_pnl_quote":0,"gross_return_r":0.0,"market_state_fresh_ratio":1.0,"max_drawdown_r":0.0,"metrics_availability":{"absolute_drawdown_quote_available":false,"absolute_drawdown_quote_note":"Max drawdown available as r-multiple only (max_drawdown_r). Absolute quote drawdown requires an equity curve with per-bar nav.","equity_curve_available":false,"equity_curve_note":"Per-bar equity snapshots not available. Drawdown computed from end-of-trade point estimates only.","fee_adjusted_returns_available":false,"sharpe_ratio_available":false,"sharpe_ratio_note":"Requires return time series (per-bar or per-trade with durations). Not computable from end-of-trade point returns alone.","slippage_note":"Execution simulator slippage is accounted for in fill prices. Per-trade slippage breakdown not exposed in trade dict.","slippage_per_trade_available":false,"trade_level_pnl_available":false},"net_pnl_quote":0,"profit_factor":0.0,"regime_fresh_ratio":1.0,"sample_size_verdict":"no_trades","sell_signals_total":0,"signals_total":0,"trades_loss_count":0,"trades_win_count":0,"win_rate":0.0},"replay_integrity":{"envelope_chain_hash":"4f53cda18c2baa0c0354bb5f9a3ecbe5ed12ab4d8e11ba873c2f11161202b945","envelope_count":0,"event_loop_states_hash":"4f53cda18c2baa0c0354bb5f9a3ecbe5ed12ab4d8e11ba873c2f11161202b945","integrity_ok":true,"run_id":"replay-db2a6fde2f0c-0002"},"report_type":"shadow_replay","run_spec":{"code_commit":"dd425062","end_ts_ms":1778505780000,"metadata":{"dataset_fingerprint":"1ae0166f9c096b2546561ec84c852c314dd537ccfc82858baaad5691722706e8","execution_provenance_id":"bt-9b93baad1f1cf3c9","mode":"baseline","scheduler_profile":"instant"},"replay_run_id":"replay-db2a6fde2f0c-0002","run_mode":"shadow","start_ts_ms":1778356680000,"strategy_id":"primary_breakout_v1","symbol":"BTCUSDT"},"schema_version":"replay_report.v1","strategy_id":"primary_breakout_v1","thresholds_applied":{"pass_fail":{"max_max_drawdown_r":3.0,"min_closed_trades_total":20,"min_expectancy_r":0.0,"min_market_state_fresh_ratio":0.99,"min_profit_factor":1.05,"min_regime_fresh_ratio":0.99,"require_data_integrity_ok":true,"require_deterministic_replay_ok":true},"threshold_profile_id":"primary_breakout_v1_validation_thresholds","threshold_profile_version":"1"}}