{"artifact_manifest":{"envelope_log_uri":"none","event_loop_states_uri":"none","report_artifact_uri":"artifacts\\calibration\\2961\\pilot_validation\\replay-16a0a8f6d92f-0001\\report.json","supplementary_artifacts":{"config_resolved_uri":"artifacts\\calibration\\2961\\pilot_validation\\replay-16a0a8f6d92f-0001\\config.resolved.json","env_redacted_uri":"artifacts\\calibration\\2961\\pilot_validation\\replay-16a0a8f6d92f-0001\\env_redacted.txt","operator_summary_uri":"artifacts\\calibration\\2961\\pilot_validation\\replay-16a0a8f6d92f-0001\\operator_summary.json"}},"config_snapshot":{"breakout_buffer":0.0005,"entry_lookback_minutes":240,"exit_lookback_minutes":120,"min_minutes_between_entries":60,"trade_side_mode":"long_only"},"dataset_summary":{"candles_total":475,"dataset_fingerprint":"25ae0aa84735dc2d1654877aa48baf5c2eb1479616ac56a34b8aaf4ca5eb39ce","period_end_ts_ms":1776991380000,"period_start_ts_ms":1776977340000,"requested_period_end_ts_ms":1776991380000,"requested_period_start_ts_ms":1776962940000,"scheduler":{"event_time_span_ms":14040000,"live_candle_count":235,"profile":"instant","warmup_count":240},"symbol":"BTCUSDT","timeframe":"1m"},"envelope_summary":{"decision_envelopes_total":0,"fill_envelopes_total":0,"order_envelopes_total":0},"execution_result":{"decisions_made":0,"envelope_hashes":[],"events_processed":475,"fills_recorded":0,"orders_placed":0,"run_id":"replay-16a0a8f6d92f-0001"},"gate_result":{"failed_criteria":["min_closed_trades_total","min_profit_factor"],"notes":"failed criteria","review_flags":[],"status":"FAIL"},"metrics":{"buy_signals_total":0,"closed_trades_total":0,"data_integrity_diagnostics":{"data_integrity_reason":"clean","pending_signals_at_end":[]},"data_integrity_ok":true,"deterministic_replay_ok":true,"expectancy_r":0.0,"market_state_fresh_ratio":1.0,"max_drawdown_r":0.0,"profit_factor":0.0,"regime_fresh_ratio":1.0,"sell_signals_total":0,"signals_total":0,"win_rate":0.0},"replay_integrity":{"envelope_chain_hash":"4f53cda18c2baa0c0354bb5f9a3ecbe5ed12ab4d8e11ba873c2f11161202b945","envelope_count":0,"event_loop_states_hash":"4f53cda18c2baa0c0354bb5f9a3ecbe5ed12ab4d8e11ba873c2f11161202b945","integrity_ok":true,"run_id":"replay-16a0a8f6d92f-0001"},"report_type":"shadow_replay","run_spec":{"code_commit":"ed661362","end_ts_ms":1776991380000,"metadata":{"dataset_fingerprint":"25ae0aa84735dc2d1654877aa48baf5c2eb1479616ac56a34b8aaf4ca5eb39ce","execution_provenance_id":"bt-258d24ac9b6d8391","mode":"baseline","scheduler_profile":"instant"},"replay_run_id":"replay-16a0a8f6d92f-0001","run_mode":"shadow","start_ts_ms":1776977340000,"strategy_id":"primary_breakout_v1","symbol":"BTCUSDT"},"schema_version":"replay_report.v1","strategy_id":"primary_breakout_v1","thresholds_applied":{"pass_fail":{"max_max_drawdown_r":3.0,"min_closed_trades_total":20,"min_expectancy_r":0.0,"min_market_state_fresh_ratio":0.99,"min_profit_factor":1.05,"min_regime_fresh_ratio":0.99,"require_data_integrity_ok":true,"require_deterministic_replay_ok":true},"threshold_profile_id":"primary_breakout_v1_validation_thresholds","threshold_profile_version":"1"}}